{
  "artifact_hash": "sha256:097f173d4ac0f32803ba99aa642be8d73db7bd503e6347f84a8a4c9b7e207c12",
  "backend": {
    "backend_id": "opendrop_ewod_dry_run",
    "backend_version": "0.1.0-alpha"
  },
  "metadata": {
    "dry_run": true,
    "hardware_io_enabled": false,
    "opendrop_adapter": "opendrop-ewod-dry-run"
  },
  "profile": {
    "profile_id": "dmf",
    "profile_version": "v1"
  },
  "run_id": "opendrop-ewod-dry-run",
  "runbook_hash": "sha256:69d0986d862ba895ba1aba12e80321b70b0d43e00c2fc1d7de453bde9ed581f4",
  "timebase": "DEVICE_TICKS",
  "trace_id": null,
  "trace_steps": [
    {
      "applied": true,
      "details": {
        "adapter_command": "SET_ELECTRODES",
        "channel_ids": [
          1
        ],
        "dry_run": true,
        "electrode_ids": [
          "E0001"
        ],
        "hardware_io_enabled": false,
        "intent_id": "intent-0001"
      },
      "error_code": null,
      "issued": true,
      "operation": "DMF_SET_CHANNELS",
      "runbook_step_id": "step-0001",
      "status": "APPLIED",
      "step_id": "step-0001",
      "tick": 0
    },
    {
      "applied": true,
      "details": {
        "adapter_command": "SET_ELECTRODES",
        "channel_ids": [
          2
        ],
        "dry_run": true,
        "electrode_ids": [
          "E0002"
        ],
        "hardware_io_enabled": false,
        "intent_id": "intent-0002"
      },
      "error_code": null,
      "issued": true,
      "operation": "DMF_SET_CHANNELS",
      "runbook_step_id": "step-0002",
      "status": "APPLIED",
      "step_id": "step-0002",
      "tick": 1
    }
  ],
  "trace_version": "klein.execution_trace.v1"
}
